"Honeywell International Inc.","Honeywell","139691877","855 S Mint St","","","Charlotte","North Carolina","28202","United States","1-704-627-6200","","","http://www.honeywell.com","3.6662E10","7.159E9","6.1525E10","","3237","95000","Honeywell International Inc (Honeywell) is an engineering and technology company. The company invents and manufactures technologies that address challenges in various sectors including energy, security, safety, productivity and global urbanization. Honeywell offers specialty chemicals, process technologies, electronic and advanced materials, productivity, sensing, safety and security technologies, and spare components. It also provides management and technical services, repair, overhaul, and maintenance services. Honeywell serves customers in the aerospace, refining and petrochemicals, buildings and industries in North America, Europe and other regions. It has manufacturing and other facilities across the world. Honeywell is headquartered in Charlotte, North Carolina, the US.The company reported revenues of (US Dollars) US$35,466 million for the fiscal year ended December 2022 (FY2022), an increase of 3.1% over FY2021. In FY2022, the company’s operating margin was 18%, compared to an operating margin of 21% in FY2021. In FY2022, the company recorded a net margin of 14%, compared to a net margin of 16.1% in FY2021.","Public","Corporation","Parent","true","HON","Honeywell International Inc.","United States","Honeywell International Inc.","United States","Aircraft Engine and Parts Manufacturing","37240000","Aircraft engines and engine parts","3724","Aircraft Engines and Engine Parts","336412","Aircraft Engine and Engine Parts Manufacturing","3030","Manufacture of air and spacecraft and related machinery","3030","Manufacture of air and spacecraft and related machinery","3030","Manufacture of air and spacecraft and related machinery","2394","Aircraft Manufacturing and Repair Services","false","43863379","D&B","Has Not Opted Out of Direct Marketing"
"Analog Devices, Inc.","ADI","001418417","1 Analog Way","","","Wilmington","Massachusetts","01887","United States","1-781-935-5565","","","http://www.analog.com","1.2305539E10","3.608003E9","4.8794477E10","","1000","26000","Analog Devices Inc (Analog Devices) designs, manufactures and markets analog, mixed-signal, and digital signal processing integrated circuits (ICs). The company's products find applications in data converters, amplifiers, power management, and radio frequency (RF). It serves instrumentation, aerospace and defense, building technology, consumer, communications, healthcare, energy, security and surveillance, and automotive industries. Analog Devices markets products through direct sales force, independent sales representatives, third-party distributors, and through website. The company operates manufacturing centers in the US, the Philippines, Ireland, Thailand and Malaysia. Its business operations span across the Americas, Europe, Africa, and Asia-Pacific. Analog Devices is headquartered in Wilmington, Massachusetts, the US.The company reported revenues of (US Dollars) US$7,318.3 million for the fiscal year ended October 2021 (FY2021), an increase of 30.6% over FY2020. In FY2021, the company’s operating margin was 20.2%, compared to an operating margin of 26.7% in FY2020. In FY2021, the company recorded a net margin of 19%, compared to a net margin of 21.8% in FY2020.","Public","Corporation","Parent","true","ADI","Analog Devices, Inc.","United States","Analog Devices, Inc.","United States","Semiconductor and Other Electronic Component Manufacturing","36740200","Integrated circuits, semiconductor networks, etc.","3674","Semiconductors and Related Devices","334413","Semiconductor and Related Device Manufacturing","2611","Manufacture of electronic components","2610","Manufacture of electronic components and boards","2611","Manufacture of electronic components","2429","Other Electronic Equipment Manufacturing","false","2101","D&B","Has Not Opted Out of Direct Marketing"
"Starbucks Corporation","Starbucks, Starbucks Coffee","155366107","2401 Utah Ave S Ste 800","","","Seattle","Washington","98134-1435","United States","1-206-447-1575","","","http://www.starbucks.com","3.5975598E10","5.4019E9","2.94455E10","","763","381000","Starbucks Corp (Starbucks) is a retailer and roaster of specialty coffee in the world. The company, through its stores, offers coffee, handcrafted beverages, merchandise, and food items. Starbucks also offers whole bean and ground coffee, Starbucks Coffee, Seattle’s Best Coffee, Teavana, Evolution Fresh, and Starbucks Reserve.   As of October 3, 2022, Starbucks operated through a network of 35,711 stores including 18,253 company-operated and 17,458 licensed stores.   Starbucks operates in four segments: North America, International, Channel Development, and Corporate and Other.   Starbucks classified its operations into three product categories: Beverage, Food, and Other.","Public","Corporation","Parent","true","SBUX","Starbucks Corporation","United States","Starbucks Corporation","United States","Restaurants and Bars","58120304","Coffee shop","5812","Eating Places","722513","Limited-Service Restaurants","5610","Restaurants and mobile food service activities","5610","Restaurants and mobile food service activities","5610","Restaurants and mobile food service activities","451","Cafes, Restaurants and Takeaway Food Services","false","134648","D&B","Has Not Opted Out of Direct Marketing"
"Micron Technology, Inc.","","093120871","8000 S Federal Way","","","Boise","Idaho","83716-7128","United States","1-208-368-4000","","","http://www.micron.com","1.554E10","'-5.658E9","6.4254E10","","2868","43000","Micron Technology Inc (Micron) is a provider of memory and storage solutions such as NOR Flash, NAND, DRAM and 3D XPoint memory. The company offers its products and solutions under the Micron, and Crucial brand names. It serves the data center, mobile, client, industrial, consumer, automotive, graphics, and networking markets.   The company classifies its business operations into five reportable segments: Compute and Networking Business Unit (CNBU), Mobile Business Unit (MBU), Storage Business Unit (SBU), Embedded Business Unit (EBU), and All Other.   Micron operates 11 manufacturing sites in 17 countries and has 15 customer labs.","Public","Corporation","Parent","true","MU","Micron Technology, Inc.","United States","Micron Technology, Inc.","United States","Semiconductor and Other Electronic Component Manufacturing","36740209","Random access memory (RAM)","3674","Semiconductors and Related Devices","334413","Semiconductor and Related Device Manufacturing","2611","Manufacture of electronic components","2610","Manufacture of electronic components and boards","2611","Manufacture of electronic components","2429","Other Electronic Equipment Manufacturing","false","19172","D&B","Has Not Opted Out of Direct Marketing"
"Lam Research Corporation","Lam Research, Lam","038137956","4650 Cushing Pkwy","","","Fremont","California","94538-6401","United States","1-510-572-0200","","","http://www.lamresearch.com","1.4905386E10","4.360222E9","1.8744729E10","","1413","17450","Lam Research Corp (Lam) is a manufacturer and supplier of wafer fabrication equipment and services. The company designs, manufactures, refurbishes, markets and services semiconductor processing systems that are used in the fabrication of integrated circuits. It offers thin film deposition; plasma etch and single wafer clean processes and products. The company provides discrete and power devices, analog and mixed signals, transducers and sensors, packaging, memory, patterning, interconnect, and transistor solutions. It serves to various markets, including semiconductor foundry, memory, and integrated device manufacturers, power semiconductor, light emitting diode, dynamic random-access memory (DRAM), radio frequency device and micro-electromechanical systems. The company’s operations span across the US, Asia, and Europe. Lam is headquartered in Fremont, California, the US.The company reported revenues of (US Dollars) US$17,227 million for the fiscal year ended June 2022 (FY2022), an increase of 17.8% over FY2021. The operating profit of the company was US$5,381.8 million in FY2022, compared to an operating profit of US$4,482 million in FY2021. The net profit of the company was US$4,605.3 million in FY2022, compared to a net profit of US$3,908.5 million in FY2021.","Public","Corporation","Parent","true","LRCX","Lam Research Corporation","United States","Lam Research Corporation","United States","Semiconductor and Other Electronic Component Manufacturing","36740213","Wafers (semiconductor devices)","3674","Semiconductors and Related Devices","334413","Semiconductor and Related Device Manufacturing","2611","Manufacture of electronic components","2610","Manufacture of electronic components and boards","2611","Manufacture of electronic components","2429","Other Electronic Equipment Manufacturing","false","17115","D&B","Has Not Opted Out of Direct Marketing"
"Gilead Sciences, Inc.","AmBisome, Atripla, Biktarvy, Cayston, Complera","185049848","333 Lakeside Dr","","","Foster City","California","94404-1394","United States","1-650-574-3000","","","http://www.gilead.com","2.7116E10","6.859E9","6.2125E10","","289","18000","Gilead Sciences Inc (Gilead) is a research-based biopharmaceutical company. It is engaged in the discovery, development and commercialization of medicines for the treatment of cardiovascular, hematological and respiratory diseases, inflammation, liver diseases, cancer, and human immunodeficiency virus (HIV) infection. The company sells its products through subsidiaries and distributors in Europe, the Americas, Asia-Pacific, the Middle East and Africa. It has manufacturing facilities in Edmonton, Alberta, Canada; Foster City, San Dimas, Oceanside, California; and Cork, Ireland among others. The company has partnerships with universities, medical research institutions and global pharmaceutical leaders to develop new drugs. Gilead is headquartered in Foster City, California, the US.The company reported revenues of (US Dollars) US$27,281 million for the fiscal year ended December 2022 (FY2022), a decrease of 0.1% over FY2021. In FY2022, the company’s operating margin was 26.9%, compared to an operating margin of 36.3% in FY2021. In FY2022, the company recorded a net margin of 16.8%, compared to a net margin of 22.8% in FY2021.","Public","Corporation","Parent","true","GILD","Gilead Sciences, Inc.","United States","Gilead Sciences, Inc.","United States","Pharmaceutical Manufacturing","28340000","Pharmaceutical preparations","2834","Pharmaceutical Preparations","325412","Pharmaceutical Preparation Manufacturing","2120","Manufacture of pharmaceutical preparations","2100","Manufacture of pharmaceuticals, medicinal chemical and botanical products","2120","Manufacture of pharmaceutical preparations","1841","Human Pharmaceutical and Medicinal Product Manufacturing","false","126071","D&B","Has Not Opted Out of Direct Marketing"
"Mondelez International, Inc.","Mondelez International","877147228","905 W Fulton Market Ste 200","","","Chicago","Illinois","60607-1325","United States","1-847-943-4000","","","http://www.mondelezinternational.com","3.6016E10","5.88E9","7.1391E10","","941","91000","Mondelez International Inc (Mondelez) manufactures and markets food products and beverages. The company's product portfolio comprises snacks including cookies, crackers, and salted snacks, chocolate, candy, cheese and grocery and beverages. It markets products under the Barni, belVita, Chips Ahoy, Club Social, Enjoy Life Foods, Cadbury Dairy Milk, 5 Star, Clorets, Halls, Maynards Bassetts, Sour Patch Kids, Stride, Trident, Philadelphia, Bournvita and Tang brand names. The company sells products to supermarket chains, wholesalers, club stores, mass merchandisers, distributors, gasoline stations, convenience stores, value stores, drug stores, and other retail food outlets. It operates a network of manufacturing facilities across the Americas, Asia, the Middle East and Africa, and Europe. Mondelez is headquartered in Chicago, Illinois, the US.The company reported revenues of (US Dollars) US$31,496 million for the fiscal year ended December 2022 (FY2022), an increase of 9.7% over FY2021. In FY2022, the company’s operating margin was 10.8%, compared to an operating margin of 15.7% in FY2021. In FY2022, the company recorded a net margin of 8.6%, compared to a net margin of 15% in FY2021.","Public","Corporation","Parent","true","MDLZ","Mondelez International, Inc.","United States","Mondelez International, Inc.","United States","Food Manufacturing","20229903","Processed cheese","2022","Natural, Processed, and Imitation Cheese","311513","Cheese Manufacturing","10512","Butter and cheese production","1050","Manufacture of dairy products","1051","Operation of dairies and cheese making","1133","Cheese and Other Dairy Product Manufacturing","false","303883","D&B","Has Not Opted Out of Direct Marketing"
"Intel Corporation","","047897855","2200 Mission College Blvd","","","Santa Clara","California","95054-1549","United States","1-408-765-8080","","","http://www.intel.com","5.4228E10","7.62E8","1.91572E11","","2463","124800","Intel Corp (Intel) designs and develops technology products and components. The company’s product portfolio comprises microprocessors, chipsets, embedded processors and microcontrollers, flash memory, graphic, network and communication, and conferencing products. It also offers motherboards, solid state drives, server products, wireless connectivity products and software and applications. Intel sells its products and solutions to original equipment manufacturers, industrial and communications equipment manufacturers and original design manufacturers. The company’s products find application in notebooks, tablets, servers and desktops. Intel markets processors under Core, Quark, Atom, Celeron, Pentium, Xeon, and Itanium brand names. The company has business operations in China, Singapore, the US, and Taiwan. Intel is headquartered in Santa Clara, California, the US.The company reported revenues of (US Dollars) US$63,054 million for the fiscal year ended December 2022 (FY2022), a decrease of 20.2% over FY2021. In FY2022, the company’s operating margin was 5.3%, compared to an operating margin of 24.6% in FY2021. In FY2022, the company recorded a net margin of 12.7%, compared to a net margin of 25.1% in FY2021.","Public","Corporation","Parent","true","INTC","Intel Corporation","United States","Intel Corporation","United States","Semiconductor and Other Electronic Component Manufacturing","36740207","Microprocessors","3674","Semiconductors and Related Devices","334413","Semiconductor and Related Device Manufacturing","2611","Manufacture of electronic components","2610","Manufacture of electronic components and boards","2611","Manufacture of electronic components","2429","Other Electronic Equipment Manufacturing","false","15610","D&B","Has Not Opted Out of Direct Marketing"
